s.no,person1,person2
162,"How do I stay hungry for growth?","Never declare yourself complete. There's always more to learn. There's always higher to reach. There's always deeper to understand. When you believe you've arrived, decline begins. Hunger keeps you growing. Maintain it. Stay curious. Ask questions constantly. Admit what you don't know. Surround yourself with people smarter than you. Read widely. Travel. Expose yourself to new ideas. Hunger is choice. Choose it. You're not finished. You'll never be finished. That's the point. Keep growing."
163,"Should I trust my instincts or rely on logic?","Both serve you. Instinct is unconscious processing. Logic is conscious analysis. Instinct often detects patterns your conscious mind hasn't articulated. Logic ensures you're not just following fear. Together they're powerful. Instinct without logic can be impulsive. Logic without instinct can be mechanical. In high-stakes decisions, when logic suggests one thing but gut says another, investigate. Usually gut is picking up something real. Then logic confirms it. Trust both. Let them guide together."
164,"How do I make peace with time passing quickly?","Time passing quickly means living fully. Boring time crawls. Engaged time flies. When you're present, time moves fast. This is actually good news. You're living. You're engaged. Use this knowledge. Be even more intentional. Savor moments. Don't waste days on things that don't matter. Quality of time matters more than quantity. Focus on presence. Put down your phone. Have real conversations. Experience deeply. Time is flying because you're finally truly living."
165,"What if my goals change as I grow?","That's not failure; that's wisdom. You're learning. You're evolving. Your goals should change. If goals stay identical as you grow, they were too small. Changing goals means you're gaining clarity. New information arrives. You mature. Your values deepen. Let your goals evolve. Don't cling to old goals because you feel obligated. Flexibility is strength. Redirect toward what matters now. Growth includes changed direction. This is perfect. You're supposed to outgrow old goals. Grow into new ones."
166,"How do I know if I'm being realistic or limiting myself?","Ask: Is this based on evidence or fear? Limitations based on evidence are realistic. You can't dunk if you're 5'2". That's not limiting; that's reality. But many limitations are just fear wearing the costume of realism. You tell yourself it's impossible when it's actually just uncomfortable. Examine your limits closely. Are they real or assumed? Try first. Let results teach. Most people underestimate capability. Push into discomfort. Test your limits. You're probably capable of more."
167,"Why do I feel guilty for taking time for myself?","Self-care isn't selfish. Rest isn't laziness. Taking time for yourself is maintenance. You wouldn't feel guilty maintaining your car. Your body is more important than your car. Maintain it. Rest, exercise, reflect, recreate. These aren't luxuries; they're requirements. Guilt signals conditioning. You were taught to prioritize others above self. But sacrificing yourself serves no one. You're less capable when depleted. Taking care of yourself enables taking care of others. Take that time guilt-free."
168,"Can I really change the world?","You can change your world. When you change, your world changes. You affect people around you. They affect people around them. Ripples spread. History shows that ordinary people created extraordinary change. One person standing up. Others joining. Change compounds. You probably won't change the global world alone. But your corner of the world? Absolutely. Change your circumstances. Lift your community. Serve your circle. Collective individual change becomes global change. Start in your sphere."
169,"What if I'm too old or too young?","Age is irrelevant to capability. You're not too old or too young. You're exactly the right age for your life. Older people have experience and perspective younger people lack. Younger people have energy and flexibility older people lack. Each age has gifts. Stop using age as excuse. Start using age as advantage. Age is happening anyway. Use your current age for what it's good for. Stop fighting it. Leverage it. You're perfect at your age for your purpose."
170,"How do I handle the pressure of high expectations?","Expectations are others' movies. Your job is living your movie. You can't control others' expectations. You can control your response. Set expectations for yourself internally. These matter. Others' expectations are just noise unless you let them become your expectations. Disappoint others if needed. Don't disappoint yourself. You're not living for their approval. You're living your life. Do your best. That's all you can control. Let external expectations wash over you. Focus internal."
171,"Should I keep my goals secret or share them?","Share them. Speaking goals aloud creates accountability. Others will ask. Anticipating questions clarifies goals. Sharing also builds community. Others might offer help. Support arrives. Silence keeps goals private but also keeps you isolated. Public commitments increase follow-through. You're more likely to achieve what you've declared. Accountability works. Tell people your goals. Let them champion you. Let them hold you accountable. You're stronger with community. Share your goals. Get support."
172,"Why do successful people keep trying new things?","Mastery requires depth. Growth requires breadth. The best approach is both. Deep expertise in your primary field. Breadth through exploring new areas. New experiences reveal connections old patterns hide. New challenges prevent stagnation. Trying new things keeps minds young. It reveals strengths you didn't know you had. Neuroscience shows that learning new skills creates new neural pathways. Keep trying new things. You'll discover hidden talents. You'll prevent mental decline. Stay curious. Try new things constantly."
173,"How do I celebrate progress without becoming complacent?","Celebrate genuinely. Then refocus. Recognition of progress is energizing and informative. It shows you what's working. Then you take that evidence and go higher. Celebration doesn't mean stopping. It means pausing to acknowledge. Then you continue. The alternative is never stopping to appreciate. That creates burnout. You need both: recognition and drive. Celebrate reaching milestones. Then set new ones. This is the rhythm of growth. Move forward. Pause. Appreciate. Continue. Repeat indefinitely."
174,"What prevents most people from achieving their potential?","Fear mostly. Second is comfort. Third is lack of clarity. Fear of failure stops people before they start. Comfort of current life prevents risk. Lack of clarity wastes effort. Address these three and watch potential activate. Ask: What am I afraid of? What comfort am I clinging to? What do I actually want? Answer honestly. Then move despite answers. Fear loses power when named. Comfort becomes less appealing when you remember your dreams. Clarity comes from action. Move forward."
175,"How do I build relationships that last?","Show up. Consistency matters more than intensity. Small regular presence beats occasional grand gestures. Remember details. Ask genuine questions. Listen. Care. Be vulnerable. Let them help you. Build reciprocal relationships, not one-directional ones. Give generously. Receive gracefully. Go deep. Relationships that last are watered daily. You can't neglect someone for years then expect closeness. Relationship is verb. It's what you do regularly. Show up for people. Do it consistently. They'll do it for you."
176,"Why do I hesitate when I know what I should do?","Hesitation signals fear. Fear is often trying to protect you. But protection can become prison. Acknowledge the fear. Thank it for caring. Then act anyway. The fear won't disappear by avoiding. It disappears by walking through it. You've walked through fear before. You survived. You're stronger. Do it again. Your hesitation is protecting you from risk. But risk is where growth lives. Feel the fear. Do it anyway. Hesitation fades with action."
177,"Should I finish everything I start?","Finishing matters. Completion builds character. But not everything deserves completion. If something fundamentally misaligns with your values, stop. Don't complete out of guilt. But do complete challenging work. Completing hard work teaches you that you can. This compounds. Others see your follow-through. That creates trust. Most people don't complete. You'll stand out if you do. Finish what you start unless it's clearly wrong. Usually, it's worth finishing. Power comes through."
178,"How do I maintain hope during dark times?","Hope is choosing to believe better times are coming despite current darkness. Hope is active. It's not passive wishing. Hope looks for possibilities. Hope takes action toward them. During dark times, find one small glimmer. Focus there. Starving for light, a candle flame seems bright. Small hope grows. Connect with others. Shared hope strengthens. Remember past times you've overcome. You've been through hard before. You survived. You'll survive this too. Hold on."
179,"What if I become successful but lose myself?","Many do. They become successful at someone else's game. They achieve external wins while internal values erode. This is possible but not inevitable. You choose. Define success your way before pursuing it. Then pursue aligned with that definition. Don't outsource your definition to others. Keep checking: Am I becoming who I want to be? Or am I becoming someone else? If misaligned, redirect. Success is only worth it if you remain yourself. Keep both."
180,"How do I stop worrying about what's outside my control?","You can't control results; you can control effort. You can't control others' opinions; you control your response. You can't control circumstances; you control your perspective. Focus energy only where you have control. Worry about uncontrollables wastes energy. That energy should go toward controllables. What can you control right now? Do that. What's outside control? Release it. This distinction transforms peace. You'll stress less. You'll accomplish more. Focus on controllables. Ignore rest."
181,"Why do dreams fade over time?","Dreams fade when disconnected from why. When you remember why you dreamed, dreams reignite. Dreams fade when surrounded by doubters. When you find believers, dreams strengthen. Dreams fade when you see no progress. When you celebrate small wins, dreams restore. Dreams fade through inaction. Through action, they intensify. Keep your dreams alive by staying connected to their purpose. Build community around them. Track progress. Move toward them daily. Dreams are living. Feed them."
182,"Can I balance being kind and being strong?","Kindness isn't weakness. Strength isn't cruelty. They're compatible. The strongest people are often kindest. They're secure. They don't need to prove anything. Weak people are often cruel. They're insecure. They prove themselves through dominance. Real strength is gentle with those below you, respectful with equals, deferential with elders. Real strength is knowing when to be tough and when to be gentle. Cultivate both. Be kind. Be strong. Both matter. You can have both simultaneously."
183,"How do I know when to fight and when to accept?","Fight when you can win or when principles demand it. Accept when you can't win or when it costs too much. This isn't cowardice. This is wisdom. Some battles aren't yours. Some principles matter more than victory. Choose your battles carefully. Don't fight every fight. Don't accept every defeat. Know the difference. Your energy is limited. Spend it on battles that matter. Accept what you can't change. Fight what matters. This balance creates peace amid struggle."
184,"Should I plan extensively or embrace spontaneity?","Plan for structure. Embrace spontaneity for surprise. Overly rigid plans prevent joy. Total spontaneity creates chaos. Both together create optimal living. Plan your big direction. Leave room for discovery. Know your priorities. Leave space for unplanned opportunities. Plans are map. Maps help but don't guarantee reaching destination. Build flexibility in. The best moment often arrives unplanned. Be structured enough to progress. Be flexible enough to enjoy journey. Both matter."
185,"Why do I feel empty despite achievements?","Achievement alone doesn't fulfill. Meaning fulfills. Purpose fulfills. Connection fulfills. Contribution fulfills. You can achieve everything and still feel empty if disconnected from meaning. Ask: Why do I want this achievement? Does this matter? Does this serve something bigger? When achievement connects to purpose, fulfillment follows. Otherwise, emptiness continues. Examine your achievements. Are they yours or someone else's? Are they meaningful or just impressive? Align achievement with meaning. Emptiness disappears."
186,"How do I handle people who think they know what's best for me?","They might be wise. Listen. But ultimately, it's your life. You live with consequences. Not them. Gather perspectives. Consider wisdom. Then decide. Don't blindly follow others' scripts. Don't foolishly ignore all input. Balance both. Wise people listen to counsel but ultimately trust themselves. They take input seriously without surrendering autonomy. You have that capability. Hear others. Thank them. Then make your own choice. Your life is your responsibility."
187,"What makes a person truly inspiring?","Inspiring people live purposefully. They're growing visibly. They're generous. They're authentic. They admit failures alongside victories. They're working on something bigger than themselves. They lead by example. They make others believe in possibility. They're not perfect; they're purposeful. Become inspiring by living inspiringly. Pursue meaning. Grow visibly. Give generously. Be authentic. Admit struggles. Contribute. Others will notice. Others will be inspired. You don't have to be perfect. Be purposeful. Purpose inspires."
188,"How do I move from knowing to doing?","There's gap between knowledge and action. Knowing doesn't change lives. Doing does. Information is available abundantly. Action is rare. You have enough knowledge. Start acting on what you know. Do one thing today based on knowledge you have. Then another tomorrow. Action builds momentum. Action reveals what you actually need to learn. Most people gather knowledge forever. Few actually move. Narrow the gap. Close the knowing-doing gap. Implement. Take action now on what you already know."
189,"Why do people fear their own power?","Power requires responsibility. Power attracts attention. Power means standing out. These create anxiety. Powerless feels safer. But safe becomes slowly suffocating. Claiming power means accountability. Means visibility. Means responsibility. But also means capability. Means freedom. Means impact. The trade is worth it. Fear whispers that power is dangerous. It is. That's why it matters. Claim power. You're meant to. Your world needs what only you can offer. Fear loosens when you act."
190,"How do I stay grounded as I ascend?","Ascension can inflate ego. Stay grounded by remembering where you came from. Remember those who helped. Acknowledge luck. Remember that success is temporary. Remain humble. Stay connected to regular life. Don't separate yourself from ordinary people. Remember that you're still learning. Stay curious. Assume you don't know everything. Serve others at your new level. Keep giving back. Humility grounds. Gratitude grounds. Connection grounds. Ascending without grounding creates emptiness. Stay grounded."
191,"What if my passion changes?","That's evolution, not betrayal. You're discovering. You're learning what actually matters. Let passion evolve. Old interests served you. They led to new understanding. New interests reflect growth. Don't cling to old passion from guilt. Follow genuine current passion. Life isn't one-track. It's multiple chapters. Each chapter builds on last but isn't identical. Embrace change. Your passion at 20 wasn't at 30. Your passion at 30 won't be at 40. That's beautiful. Grow into new passions."
192,"How do I handle criticism from people I respect?","Criticism from respected people carries weight. That's gift actually. They care enough to tell truth. Listen deeply. Separate ego. Extract truth. There's usually kernel of wisdom in meaningful criticism. Some criticism is gift. Some is just opinion. Distinguish. Thank them for caring. Consider what they said. Implement what's useful. Ignore what's not. You're not obligated to accept all criticism. But don't dismiss it reflexively. Trusted critics often see things you miss."
193,"Should I stay loyal to people who've moved on?","Loyalty to people who've chosen to leave is self-harm. You can wish them well and move on. Relationships are reciprocal. When reciprocity ends, relationship ends. You don't owe endless loyalty to those who've exited. That's not loyalty; that's self-abandonment. Remember them kindly. Wish them well. Then focus energy on present people. Life is too short to chase those running away. Invest in people who invest in you. Loyalty is beautiful when mutual. When one-directional, it's loss."
194,"How do I build resilience?","Resilience is built through challenge. You can't build it avoiding difficulty. Resilience is survival. It's falling and rising. It's feeling broken and healing. Each challenge survived strengthens you. Support system matters. You're more resilient connected. You're less resilient isolated. Build community. Practice self-compassion. Learn from failures. Keep showing up despite difficulty. Resilience isn't about not falling. It's about rising. You get stronger each time you fall and rise. That's how resilience builds."
195,"Why do I doubt myself despite past wins?","Doubt is natural but not truth. You have evidence of capability. Doubt doesn't change facts. You've won. You've overcome. You've grown. Past victories are proof. When doubt arrives—and it will—remember them. You're not starting fresh. You're building on foundation. Doubt is liar. Doubt is fear. It whispers that you're not enough. But evidence says otherwise. Trust evidence more than doubt. You're capable. Your past proves it. Believe your history."
196,"How do I stop procrastinating on important tasks?","Start before you feel ready. The first step is hardest. Usually you'll continue after starting. Use two-minute rule. Commit to two minutes. Break task into smaller pieces. Make it less intimidating. Start the smallest piece. Generate momentum. Procrastination is fear-avoidance. Action is cure. You're not lazy. You're protecting yourself from discomfort. But discomfort leads to growth. Feel the discomfort. Start anyway. Two minutes. That's all required to begin."
197,"What if I never feel ready for my dreams?","Readiness never arrives. You become ready by doing. Confidence builds through action, not preparation. You'll never feel completely ready. That's not excuse to wait. Everyone feels unprepared initially. That's normal. Start imperfectly. Learn through doing. You'll be ready for your next challenge because this one stretched you. Readiness is myth. Willingness is real. You don't need readiness. You need willingness. Be willing to start despite unreadiness. Do it anyway."
198,"How do I find peace with uncertainty?","Certainty is illusion. Life is always uncertain. Fighting uncertainty exhausts. Accepting uncertainty brings peace. You can't control whether outcomes come. You can control your effort. Control what's controllable. Release what isn't. Certainty-seeking creates anxiety. Acceptance of uncertainty creates peace. When you stop fighting uncertainty, you can work within it. You plan. You prepare. Then you trust. This combination—preparation plus acceptance—creates peace amid uncertainty. Accept it. Work with it. Move forward anyway."
199,"Should I stay or leave when situations get hard?","Ask: Is this challenge temporary or permanent? Is this misalignment fixable or fundamental? Can I grow here or only suffer? Sometimes staying and pushing through grows you. Sometimes leaving preserves you. Both are valid. Your job is knowing which applies. Temporary challenges deserve perseverance. Fundamental misalignments deserve departure. Wisdom is knowing difference. Feel your situation deeply. Trust your gut. Make decision. Then commit fully. No regret either way. You're making conscious choice based on values."
200,"What defines a life well-lived?","Living according to your values. Following your curiosity. Taking meaningful risks. Connecting deeply with others. Contributing beyond yourself. Growing throughout life. Experiencing beauty. Laughing hard. Loving fully. Serving generously. Learning endlessly. Trying despite fear. Showing up. Being authentic. Celebrating progress. Supporting others. Facing challenges courageously. A life well-lived isn't free from failure or pain. It contains both. But it's lived intentionally. It's lived authentically. It's lived generously. It's lived courageously. That's what transforms ordinary life into extraordinary one."