s.no,person1,person2
1,"Why do I keep failing even though I try my hardest?","Success isn't measured by immediate results. Like Thomas Edison said, genius is one percent inspiration and ninety-nine percent perspiration. Your failures are actually the 99% that builds your success. Each failure teaches you something valuable. Keep pushing forward because every attempt is bringing you closer to your breakthrough. The most successful people failed more than anyone else—they just didn't give up."
2,"How can I find my true purpose in life?","Many people drift through life without direction. Mark Twain said the two most important days are the day you're born and the day you find out why. Ask yourself: What problems do you want to solve? What makes you lose track of time? Your purpose emerges when you combine your talents with what the world needs. Start by exploring what gives your life meaning."
3,"Why do small actions matter when the problem is huge?","You might think your small efforts won't change anything, but James Clear reminds us that every action you take is a vote for the type of person you wish to become. Small consistent actions compound over time into massive results. A thousand small steps eventually reach the mountain top. Don't underestimate the power of starting small—that's how all great movements begin."
4,"How do I break free from negative thinking patterns?","The Buddha taught that the mind is everything. What you think, you become. If you constantly think you're a failure, your mind will find evidence to support that belief. But you can change this by deliberately choosing different thoughts. Notice your negative patterns, then consciously replace them with empowering ones. Your reality is shaped by your mental habits."
5,"What should I do when I'm completely exhausted?","Burnout is real, and Banksy offers crucial wisdom: if you get tired, learn to rest, not to quit. There's a difference between resting and giving up. Your body and mind need recovery to function optimally. Taking breaks isn't weakness—it's maintenance. Many people push until they collapse. Instead, build rest into your journey. You can't run a marathon at full sprint."
6,"How can I create a life I actually love living?","Brianna Wiest said that true self-care isn't escaping into temporary pleasures—it's building a life you don't need to regularly escape from. Most people try to fix their lives with surface solutions. Real transformation happens when you design your life intentionally. This means making tough choices today that create freedom tomorrow. Build habits, relationships, and environments that genuinely fulfill you."
7,"Can one person really make a difference?","Yes. Mahatma Gandhi said we must become the change we want to see. You don't need permission or massive resources to start. History shows that individual commitment catalyzes entire movements. When you change yourself—your habits, your thinking, your actions—you inspire others around you. Change spreads like ripples in water. Be the example, and watch others follow."
8,"Why do I feel stuck even though I'm working hard?","Hard work without direction is like running on a treadmill—you expend energy but go nowhere. Benjamin Disraeli said the secret of success is constancy to purpose. You need both effort and clarity. Ask yourself: Am I working toward something meaningful, or just staying busy? When your hard work aligns with a clear purpose, momentum builds naturally."
9,"How do I handle criticism and self-doubt?","Self-doubt whispers that you're not good enough, but that's a lie your mind tells you. Every successful person faced criticism and doubt. The difference is they didn't believe the negative voice. Remind yourself of past challenges you've overcome. Build evidence of your capabilities. Surround yourself with people who believe in you. Your inner critic is just a scared version of yourself trying to protect you."
10,"What's the real difference between dreams and reality?","Many people dream but never act. Albert Camus found that within the darkest winter lies an invincible summer—meaning your strongest self emerges through adversity. Dreams become real only through action. Vision without execution is just fantasy. Start small, stay consistent, and watch your dreams materialize into your actual life. The gap between where you are and where you want to be is filled with doing."
11,"Why do I procrastinate even when I know what to do?","Procrastination is fear in disguise. We delay because we're scared of failure, judgment, or difficulty. But delay only increases anxiety. Theodore Roosevelt said in a moment of decision, the best thing is to do the right thing. Just start. Action dissolves fear. You don't need to see the whole path—just the next step. Take it now."
12,"How can I stay motivated when progress feels slow?","Progress isn't always visible daily, but it compounds over time. Like water gradually carving a canyon, consistent effort reshapes your life. Celebrate small wins. Track your progress. When you can't see forward momentum, look back at how far you've come. Motivation follows action more than motivation creates action. Start moving, and enthusiasm will follow."
13,"Should I pursue security or take risks for growth?","Abraham Maslow said life is choosing between safety and risk. Both have value, but growth only happens in the discomfort zone. Staying safe keeps you comfortable but stuck. Taking smart risks expands your capabilities and opens new possibilities. Ask: What's the cost of playing it safe for the next five years? What's possible if I grow?"
14,"How do I find peace in an uncertain world?","Jon Kabat-Zinn said you can't stop the waves, but you can learn to surf. You can't control external chaos, but you can control how you respond. Peace comes from accepting what's beyond your control and focusing energy on what you can influence. Inner calm doesn't depend on perfect circumstances—it depends on your relationship with uncertainty."
15,"Why do people give up right before success?","Most people quit just before the breakthrough because they can't see it coming. The darkest moment is often right before dawn. Mike Ditka said you're never a loser until you quit trying. The difference between success and failure is usually persistence. Document your progress. Keep going. Your breakthrough is closer than you think."
16,"How do I choose between conflicting desires?","Multiple desires pull at you simultaneously—comfort versus growth, safety versus adventure, relationships versus ambition. The key is asking which choice aligns with the person you want to become. James Clear's wisdom applies here: every choice is a vote for that person. Make decisions based on your long-term vision, not short-term comfort. Your choices compound into your identity."
17,"What's holding me back from being authentic?","Fear of judgment keeps most people imprisoned in false versions of themselves. But Oscar Wilde said be yourself—everyone else is already taken. The energy spent pretending exhausts you. Authenticity attracts genuine connections and repels toxic ones. Start by being yourself with people you trust. Gradually expand your authentic expression. Freedom and peace come from dropping the act."
18,"How can small consistent actions transform my life?","Don't underestimate tiny habits. BJ Fogg said the quality of your life depends on the choices you make every day. One healthy choice daily leads to health. One kind action daily builds compassion. Consistency is magic because transformation is cumulative. You don't change overnight, but you change completely over years of small daily choices. Which tiny habit will you start today?"
19,"Why do many people never discover their potential?","They don't ask what's possible. They accept limitation as fact. Ralph Waldo Emerson said our strength grows out of our weaknesses. Your apparent limitations might contain your greatest strength. What if your background isn't a disadvantage but unique preparation? Start viewing your challenges as advantages. Explore what you're uniquely capable of that others aren't. Your potential awaits your discovery."
20,"How do I overcome the fear of failure?","Fear of failure paralyzes more people than actual failure ever did. Realize that failure is information, not identity. You fail at a task; you don't become a failure. Reframe: failure means you tried, you learned, you're getting closer. Every successful person failed repeatedly. Their secret? They didn't stop. Start taking small risks to prove to yourself that you survive failure."
21,"What makes a life truly worth living?","Viktor Frankl survived concentration camps by finding meaning. He taught that meaning—not pleasure or success—drives human fulfillment. Money, achievement, and comfort are hollow without purpose. What legacy do you want to leave? Who do you want to help? What problem ignites your passion? A life worth living is one lived intentionally toward something bigger than yourself."
22,"Why do I feel disconnected from my goals?","Goals feel distant when they lack emotional connection. Visualize not just achieving them but becoming the person required to achieve them. Feel the emotions of that future version. Connect daily actions to your bigger vision. Don't just chase goals—pursue transformation. When your goals are about becoming, not just having, motivation skyrockets."
23,"How do I handle setbacks without losing faith?","Setbacks are redirects, not rejections. When one path closes, another opens. Albert Camus found invincible summer in winter—meaning strength in hardship. Your response to setbacks defines you more than the setback itself. Learn what went wrong, adjust your approach, and try again. Every setback that doesn't stop you actually strengthens you."
24,"What if I've already made mistakes I can't undo?","The past is fixed, but your future is entirely unwritten. You can't change what happened, but you can change what it means. Use past mistakes as education, not punishment. Forgive yourself. Make amends where possible. Then move forward differently. Many people sabotage their future by refusing to release their past. Don't be one of them."
25,"How do I develop unshakeable confidence?","Confidence isn't from never failing—it's from failing and surviving. Build evidence. Do hard things. Keep score of challenges you've overcome. Stop seeking others' approval. Confidence grows when you prove to yourself that you can handle difficulty. Start small. Build momentum. Each success compounds into genuine, unshakeable self-belief."
26,"Why does comparison steal my peace?","Comparison is an invisible thief. When you measure yourself against others, you lose touch with your own journey. You see their highlight reel against your behind-the-scenes footage. Focus on your own progress. Celebrate others' wins without diminishing your own value. Your path is unique because you are unique. Competition is a mindset that impoverishes joy."
27,"Can I really change my life at this stage?","Your age is irrelevant. Your past is irrelevant. What matters is your decision and your next action. Transformation begins the moment you decide it will. People have changed careers at sixty, found love at seventy, discovered purpose at eighty. The beginning of your new story is now. Age is just a number; your determination is everything."
28,"How do I build habits that actually stick?","Change happens through repetition, not willpower. Start stupidly small—so small that it feels almost silly. One minute of exercise. Three pages of writing. One conversation. Consistency beats intensity. Anchor new habits to existing ones. Make them easy. Track them. After thirty days, it becomes automatic. After ninety days, it's part of your identity."
29,"What should I do when I don't feel motivated?","Motivation is overrated. Discipline is underrated. Don't wait to feel like it. Feeling follows action more than action follows feeling. Start before you're ready. Move even if you don't feel like it. After ten minutes of action, motivation usually arrives. Stop waiting for perfect conditions or perfect feelings. Imperfect action beats perfect procrastination."
30,"How can I help others while building my own life?","Giving and receiving aren't opposites—they're complements. As you climb, help others climb. Share what you've learned. Mentor. Give time. Generosity doesn't deplete you; it energizes you. You become more whole by contributing to others. Plus, helping keeps perspective. When you focus only on yourself, you feel small. When you include others in your journey, you feel connected."
31,"Why is patience considered wisdom?","Patience doesn't mean passivity. Saint Augustine said patience is the companion of wisdom. Patience is choosing to trust the process even when results aren't visible. It's watering seeds daily without demanding instant growth. Impatience makes you quit too early or lower your standards. Patience combined with consistent effort is unstoppable. Most people fail because they quit between the seed and harvest."
32,"How do I stop overthinking and start acting?","Overthinking is fear disguised as intelligence. Your brain spins scenarios endlessly, believing it's preparing you. But preparation without action is procrastination. Analysis paralysis keeps you stuck. Set a decision deadline. Make a choice. Take action. You'll learn more from one imperfect attempt than from a hundred mental rehearsals. Action is the best teacher."
33,"What does real success look like?","Real success is building a life aligned with your values. It's not the impressive title or the money alone—it's waking up wanting your life. It's relationships that matter. It's contribution that fulfills you. It's freedom to choose how you spend your days. Define success personally, not by societal metrics. Your success might look different from others, and that's the point."
34,"How do I know if I'm growing?","Growth feels uncomfortable because you're operating outside your familiar territory. Are you trying new things? Failing more? Learning? Facing fears? Uncomfortable is evidence of growth. Stagnation feels comfortable but becomes slowly suffocating. Challenge yourself regularly. If you're comfortable, you're probably not growing. Seek the edge—that zone just beyond current capability."
35,"Why do people fear their own power?","Hidden in many people is immense power they won't acknowledge. Claiming power means accountability. Power means standing out. Power attracts attention—some positive, some negative. Fear keeps people small and invisible. But suppressing your power destroys your life from inside. You were meant to contribute. Claiming your power is your responsibility to yourself and the world."
36,"How do I handle people who doubt me?","Other people's doubt says nothing about your capability—it says something about their limited vision. They doubt because they can't imagine it. But you can. Prove it to yourself first. Build conviction internally. Then their doubt won't touch you. Surround yourself with believers, but don't depend on their belief. Your belief is enough."
37,"What if my current situation seems hopeless?","Hopelessness is a feeling, not reality. It's temporary, but it feels permanent when you're in it. The Stoics taught that you can't control circumstances, but you control your response. Find one small action you can take today. Then tomorrow. Movement combats hopelessness. Reach out for support. Isolation amplifies hopelessness. Connection and action restore hope."
38,"How do I balance ambition with contentment?","These aren't opposites. Be content with who you are while ambitious about who you're becoming. Contentment kills resentment and anxiety. Ambition provides direction and growth. Together they create a peaceful drive. Without contentment, ambition becomes desperate. Without ambition, contentment becomes stagnation. Hold both simultaneously. Appreciate how far you've come and where you're heading."
39,"Why do distractions keep pulling me away?","Modern life offers infinite distractions by design. Websites, apps, and content compete for your attention. Protect your focus like a limited resource. Choose ruthlessly what gets your attention. Your focus is your power. Where attention goes, energy flows. Where energy flows, results grow. Say no to nine things to say yes to the one thing that matters."
40,"How do I find my unique voice?","Your unique voice emerges when you stop imitating others. Collect experiences. Read widely. Travel. Fail publicly. Reflect. Your voice is the intersection of your perspective, values, and experiences. No one else has exactly your combination. The world needs what only you can offer. Stop waiting for permission. Start expressing. Your voice will strengthen with use."
41,"What's the secret to lasting relationships?","Lasting relationships require showing up consistently. Not perfection, consistency. Being present matters more than being impressive. Listen deeply. Show genuine interest. Keep small promises. Remember important details. Vulnerability builds connection more than invulnerability ever will. Love is a verb—it's what you do repeatedly for someone. Relationships compound through consistent kindness."
42,"Why do I sabotage myself when close to success?","Fear of success is real. Success brings visibility, responsibility, and change. Part of you might feel unworthy or terrified of what comes next. Recognize the sabotage pattern. Question the fear. Usually it's not rational. Reframe success as an opportunity, not a threat. You deserve success. Take it. Your life expands when you do."
43,"How do I recover from a major failure?"","Major failures shake your foundation. But they also offer valuable information. First, grieve. Feel the disappointment. Then analyze: What went wrong? What did you learn? What will you do differently? Make a plan to move forward. Share your failure with trusted people—isolation amplifies pain. Every successful person experienced major failures. It's not about not failing; it's about what you do after."
44,"Can I reinvent myself at different life stages?","Yes, absolutely. You're not fixed. You can evolve, learn, change directions. People switch careers, relationships, locations, identities successfully every day. Each stage can bring new beginnings. Don't assume your past defines your future. Ask what you want to build next. Give yourself permission to become someone new. Your life doesn't have one plot—it has multiple chapters."
45,"What motivates people to change?","Change usually requires pain greater than comfort. You finally get sick enough or desperate enough or inspired enough. Inspiration is rare but powerful. Pain is more common. The best catalyst is a combination—painful reality plus inspiring vision. You want away from this and toward that. Make your vision compelling. Connect daily actions to that vision. Motivation follows clarity."
46,"How do I build resilience?","Resilience isn't about not falling; it's about rising after falling. It's built through challenge, failure, recovery. Don't avoid difficulty—face it. With each challenge you survive, your resilience strengthens. It's like muscle—you build it through resistance training. Have people in your corner. Practice self-compassion. Resilience is fifty percent strength, fifty percent flexibility—bend without breaking."
47,"Why does giving seem to diminish what I have?","This comes from scarcity thinking. The universe operates in abundance. When you give, you signal trust in abundance. This opens you to receive more. Hoarding comes from fear that there's not enough. That creates contraction. Giving creates expansion. When you help others succeed, you tap into a network of reciprocal support. Give generously. Trust the abundance mindset."
48,"How do I find peace with my imperfections?","Perfection is impossible and undesirable. Imperfections make you human and interesting. Michael J. Fox said excellence you can reach for; perfection is God's business. Stop demanding perfection from yourself. Demand progress. Learn to laugh at your mistakes. They're human, not failures of character. Your imperfections make you relatable. They give others permission to be imperfect too."
49,"What happens if I invest in my growth?","Investment compounds. Whether it's time, money, or energy spent on learning, it returns multiplied. The best investment is in yourself—your skills, knowledge, health, and mindset. These directly improve your capabilities. Education leads to better opportunities. Better health leads to better energy. Better mindset leads to better decisions. Invest in yourself and watch how everything else improves."
50,"How do I stay inspired when daily life is mundane?","Inspiration is everywhere if you look. Take different routes. Read new books. Talk to interesting people. Travel, even locally. Consume art. Create something. Daily mundanity numb your senses. Deliberately seek beauty and meaning. Keep a list of inspiring quotes. Reflect on them. Inspiration requires attention. You must actively seek it, then protect it from the noise of ordinary life."
51,"Why do some people give up during tough times?","Toughness tests your commitment. When discomfort arrives, uncommitted people quit. Committed people lean in. But commitment alone doesn't sustain people—community does. Isolation makes tough times harder. Connection makes them bearable. Also, many people quit because they haven't renewed their why. Ask constantly: Why does this matter? Why keep going? Purpose fuels persistence. When your why is strong enough, any how becomes possible."
52,"How do I know when to pivot versus persist?","There's wisdom in both. Persisting too long wastes years. Pivoting too often wastes progress. Signs to pivot: the path fundamentally misaligns with your values, repeated failure despite genuine effort, or discovering a path that excites you more. Signs to persist: temporary hardship, learning curves, seasonal struggles. Check your motivation. Are you quitting from fear or from clarity? That determines the right choice."
53,"What creates meaningful work?","Meaningful work serves a purpose beyond paychecks. It contributes to something bigger. It uses your talents. It creates value. It grows you. Many people hate work because it's disconnected from purpose. If possible, design work that matters to you. If not, find how your current work contributes. Every role serves something. Connect yourself to that purpose. Meaning transforms work into calling."
54,"How do I balance saying yes and no?","Yes opens doors but overwhelms you. No protects time but limits opportunities. Successful people say yes to aligned opportunities and no to everything else. The key is clarity on your priorities. Know your one big goal. Say yes to things supporting it. Say no to everything else, even good things. No is protecting your yes. Every yes to something is no to something else."
55,"Why do people fear being alone?","Humans are social creatures. Solitude can feel like abandonment. But aloneness and loneliness are different. Solitude is peaceful; loneliness is painful. Healthy people enjoy time alone—it's when you reconnect with yourself. Self-knowledge requires solitude. Boredom requires solitude too. Don't fear aloneness. Learn to enjoy it. This builds independence and self-sufficiency. Relationships improve when both people are content alone."
56,"How do I recover from burnout?","Burnout signals misalignment. You're giving too much or receiving too little. First, stop everything non-essential. Give yourself permission to do less. Rest—truly rest, not just sleep. Reconnect with what you love. Reassess: What's causing burnout? Is it the work or how you're doing it? Change one variable. Maybe it's boundaries. Maybe it's purpose. Maybe it's pace. Fix the root, not the symptom."
57,"What's the relationship between gratitude and abundance?","Gratitude opens your eyes to what you already have. This mindset shift is powerful. You stop focusing on lack, which attracts lack. You focus on abundance, which attracts more. Gratitude isn't ignoring problems; it's acknowledging good alongside challenges. Practice it daily. Notice three things you're grateful for. Over time, gratitude reshapes your entire perception and attracts better experiences."
58,"How do I make decisions I won't regret?","Make decisions aligned with your values. Regret usually comes from betraying yourself. When you decide from values, you're at peace even if outcomes are difficult. Ask: Will I respect myself for this choice? Will this align with who I want to become? Will I be proud telling others about this? If yes, decide. Then commit fully. Second-guessing creates regret more than the decision itself."
59,"Why do successful people keep learning?","Knowledge is compounding. What you learn today applies tomorrow and next year. Each book read, skill learned, and mistake analyzed expands capability. The moment you stop learning, you start declining. Stay curious. Ask questions. Admit what you don't know. Learning keeps you young mentally. It connects you to others. It opens possibilities. The best habit you can build is reading and reflecting consistently."
60,"How do I build a support system?","You can't succeed alone. Deliberately build community. Connect with people aligned with your values. Show vulnerability. Ask for help. Be generous with support to others. Strong systems are reciprocal—you give and receive. Choose quality over quantity. Five people who genuinely support you matter more than a thousand surface connections. Invest in relationships. They're the foundation of everything."
