s.no,person1,person2
114,"Should I try to keep my life exactly as planned?","Joseph Campbell taught we must be willing to let go of the life we've planned to have the life waiting for us. Rigid attachment to plans prevents growth. Life offers surprises—some painful, some beautiful. Plans are useful guides, not prisons. Flexibility allows you to adapt when circumstances shift. Sometimes the unplanned path is better than the planned one. Hold your plans lightly. Remain open to redirection. The best life often emerges from willingness to adjust."
115,"Do I really have power, or does the world control me?","Roseanne Barr revealed that women haven't learned that nobody gives you power—you just take it. This applies to all people. Power isn't granted; it's claimed. You have more power than you think. Most people wait for permission. They wait to be chosen. They wait for circumstances to align. But power belongs to those who claim it. Stand up. Speak up. Make decisions. Take action. Power follows boldness. Don't wait for someone to give you permission. You don't need it."
116,"What if the table has no seat for me?","Shirley Chisholm said if they don't give you a seat at the table, bring a folding chair. Exclusion is real. Barriers exist. But they shouldn't stop you. When traditional doors close, create new ones. Don't accept being excluded from conversations about your own future. Insert yourself. Speak up. Build alternatives. History shows that those excluded often create better opportunities than those who were included. Bring your own chair. Make space. Your voice deserves to be heard whether they invite you or not."
117,"Why should I speak up when my voice seems small?","Malala Yousafzai said I raise my voice not so I can shout but so those without a voice can be heard. Speaking up isn't about ego or volume. It's about justice. When you have privilege, voice, or platform, using it for those who don't is responsibility. Your individual voice matters because it adds to collective volume. Silence enables wrong. Speaking enables change. Don't minimize your voice. Use it for good. Progress requires people willing to speak."
118,"Is self-care important or is it selfish?","When a woman becomes her own best friend, life becomes easier. Self-care isn't selfish; it's necessary. You can't serve others well from depletion. You can't give what you don't have. When you treat yourself as your best friend—with kindness, respect, and care—you become stronger. This strength overflows to others. Self-care is radical because the world teaches self-sacrifice. But sustainable giving requires sustainable self-maintenance. Become your own best friend. Everything else improves."
119,"How do my actions communicate more than my words ever could?","Ralph Waldo Emerson said what you do speaks so loudly that I cannot hear what you say. Actions reveal truth. Words can deceive, but consistent actions reveal character. Your behavior matters more than your promises. People judge you by what you do repeatedly, not what you say once. This is freeing. Stop perfecting words and perfect actions. Live your values. Show integrity through behavior. Your actions write your story far more powerfully than any words."
120,"Should I let education stop my learning?","Mark Twain said he never let his schooling interfere with his education. Formal education is one tool, not the only source of learning. The world teaches constantly. Read widely. Travel. Talk to people. Try things. Notice patterns. Your greatest education comes from life experience and deliberate reflection. Don't assume school means learning is over. Don't assume credentials mean you're educated. Keep learning your entire life. Curiosity and application matter more than degrees."
121,"How do I stay motivated when the work feels small?","If you can't do great things yet, do small things in a great way. Excellence doesn't depend on task size. A small task done excellently teaches you to do big tasks excellently. Master the fundamentals. Perfect your craft. Your reputation builds through quality work regardless of scale. Small tasks become portfolio pieces. They demonstrate your standards. When bigger opportunities come, you're ready. Never despise small beginnings. Excellence scales. Start where you are and do it perfectly."
122,"How do I keep going after repeated failures?","It's not whether you get knocked down; it's whether you get up. Failure is guaranteed for anyone doing anything worthwhile. The measure of success isn't how many times you fall but how many times you rise. Each rising strengthens you. Each failure contains information. Extract it and adjust. Resilience is built through falling and rising repeatedly. Others might fall and stay down. You fall and rise. That difference compounds into success. Keep rising."
123,"Can ordinary people make lasting impact?","The courage to be the best version of yourself creates impact. Most impact comes from ordinary people doing extraordinary work. You don't need celebrity or wealth. You need commitment to growth and contribution. When you become your best self, you inspire others to become theirs. Ripples spread. Your growth catalyzes growth in others. Your courage gives others courage. Extraordinary impact comes from ordinary people with uncommon commitment. Become excellent. Watch impact multiply far beyond what you imagined."
124,"How do I find what I'm supposed to do?","Martin Luther King, Jr. asked what are you doing for others. Your purpose often emerges from the intersection of your talents and others' needs. Stop focusing only on yourself. Look around. What problems frustrate you? What populations call to you? What could you do that would serve? Purpose is less about finding yourself and more about finding how you can serve. Contribution clarifies purpose. Start serving and watch clarity emerge. Your purpose often finds you through action."
125,"Should I say yes to everything or learn to decline?","If you want more time, freedom, and energy, start saying no. Yes creates obligation. No creates space. Most people overcommit. They spread too thin. They accomplish little in many areas instead of excellence in few. Saying no isn't rejection; it's protection. When you say no to wrong things, you say yes to right things. Saying no is actually saying yes to your real priorities. Practice saying no. Watch your life focus and improve dramatically."
126,"What if an opportunity seems unlikely to succeed?","If a window of opportunity appears, don't pull down the shade. Opportunities aren't common. When they arrive, most people are afraid. They see reasons why it won't work. They hesitate. Meanwhile, bold people act. Some fail. Some win. But hesitators never know. Opportunities rarely come perfectly packaged. They usually appear risky. Trust opportunity more than comfort. Step through the door. You can handle whatever's on the other side. Hesitation costs more than action."
127,"How do I focus on my main goal amid many demands?","From The Art of Possibility: remember you're here today to cross the swamp, not to fight all the alligators. You can't solve every problem. You can't fight every battle. You'll be consumed and achieve nothing. Stay focused on your primary objective. When distractions appear—and they will—remind yourself what you're actually trying to accomplish. Resist the temptation to handle every issue. Cross your swamp. Ignore the alligators. Your primary goal demands your focus."
128,"Does yesterday's failure define my capabilities today?","Don't let yesterday take up too much of today. The past teaches but doesn't dictate. Yesterday's failure was yesterday's learning. Today is a new opportunity. Many people carry yesterday's shame into today's potential. They self-sabotage because they believe yesterday defines them. But you're not who you were yesterday. You're who you're becoming today. Make today different. Don't repeat yesterday's mistakes, but don't let them paralyze you. Today is unwritten. Write it excellently."
129,"Why do people see problems in opportunities?","The pessimist sees difficulty in every opportunity. The optimist sees possibility in every difficulty. Both are true simultaneously. The same situation contains both difficulty and opportunity. Your perspective determines what you focus on. Pessimists focus on barriers and confirm their belief that failure is inevitable. Optimists focus on possibilities and find paths forward. Your worldview shapes your results. Choose to be an optimist. See problems as puzzles to solve. Watch your capability expand."
130,"How do I start learning when I feel overwhelmed?","To know how much there is to know is the beginning of learning to live. Overwhelm comes from seeing all you don't know. But this is actually wisdom. You're waking up to complexity. Now start. Pick one area. Learn one thing. Then another. Knowledge builds. No one learns everything at once. Everyone learns sequentially. Your awareness that you have much to learn is actually the starting point. Begin small. Learn continuously. Overwhelm becomes curiosity when you act."
131,"Why do some succeed while equally talented people struggle?","Your attitude determines the opportunities and solutions you'll see in life. Keep your mind open and positive to give yourself the very best chance to succeed. Talented people with closed, negative mindsets miss opportunities. Moderately talented people with open, positive mindsets see possibilities everywhere. Mindset filters perception. A positive mind attracts solutions. A negative mind attracts problems. The world is neutral. Your mindset determines what you notice and therefore what you can use. Choose positivity deliberately."
132,"When everything feels difficult, how do I keep faith?","I know this totally sucks, but you totally don't suck, and there's a new day tomorrow when you can turn this around. Difficult periods feel permanent while you're in them. But they're temporary. Tomorrow brings fresh possibility. You're not failing; you're struggling through a difficult chapter. That's different. Your worth isn't determined by this moment. New days genuinely offer new chances. Take it one day at a time. Tomorrow will be different. Hold on."
133,"Should I believe I can do amazing things?","You can do amazing things! I know. I've seen it many times before. Just wanted to remind you of that. Sometimes you forget your own capability. You're more capable than you believe. You've likely already done amazing things you've underestimated. Confidence erodes when you focus on current struggle. But capability is proven. You have evidence in your past. You have strength you haven't fully accessed. You're capable of more than you think. Believe it. Act on it."
134,"What if this hard season never ends?","I just know that this will pass and that the next chapter in life will be wonderful. Hard seasons don't last forever. This is temporary. After every winter comes spring. After struggle comes rest. After difficulty comes clarity. The seasons of life are real. You're not stuck; you're in a season. Knowing this changes everything. The chapter you're in isn't the final one. Wonderful chapters wait. Keep going. The next chapter is coming. Trust timing."
135,"Am I alone in my struggles?","I am here, ready to listen and talk to you through your saddest moments and toughest days. So give me a call whenever you need to. You're not alone. Others care. Connection during difficulty isn't weakness; it's wisdom. Isolation amplifies pain. Shared experience reduces it. Don't face difficult times alone. Reach out. Talk. Listen. Others are here. Vulnerability creates connection. Your struggle is an opportunity for others to show they care. Let them. You need them."
136,"How do I start when nothing feels ready?","Beginnings are always messy. That's OK. The important thing is that you get started. Waiting for perfect conditions wastes years. Perfect never comes. So begin imperfectly. Start messy. Refinement happens through action, not planning. You'll figure things out as you go. The difference between people who accomplish and people who dream is that accomplishers start before they're ready. Begin today. Messy action beats perfect inaction. Movement reveals paths. Start."
137,"When I want to give up, what should I remember?","When life is tough, hope whispers: I'll try again tomorrow. Giving up feels like relief temporarily but creates regret permanently. Tomorrow brings new energy. Tomorrow you might see solutions invisible today. Hopelessness is temporary, not permanent. When you feel like quitting, that's when you're closest to breakthrough. Most people quit just before success. Don't be most people. Tell yourself you'll try again tomorrow. That's all required. One more day. One more attempt."
138,"How do I face difficulty with courage?","I love you. I support you. And I think you're facing this with so much courage. You're stronger than you know. Others see your strength even when you don't. You're doing hard things. That takes courage. You're showing up despite fear. That's what courage is. Acknowledge your own bravery. Let others' belief support yours. You're not weak; you're fighting battles others can't see. Keep fighting. Keep going. You've got this."
139,"What should I do today to move forward?","Do one brave thing today. One action moves you forward. One brave choice shifts momentum. You don't need massive action. You need consistent action. Today do one brave thing. Tomorrow, do another. Over weeks and months, these accumulate into transformation. Bravery isn't comfortable. That's why it works. It pushes you beyond habit. One brave action today creates the foundation for bigger actions tomorrow. Do it now. Don't wait. One thing. Do it today."
140,"Should I follow someone else's plan for my life?","Someone else's script isn't for you. Write your own. Forge your own path in this life. You're unique. Your path should be too. Following someone else's blueprint means succeeding at someone else's life. You want to succeed at your own. Your path requires your creativity, your vision, your decisions. Taking it risks failure. Not taking it guarantees a life that isn't truly yours. Write your own story. It might be messier. It will be yours. That's worth everything."
141,"Why do I need to start if I don't have all the time I need?","Time does not wait for anyone. Start today. Waiting for perfect timing guarantees you'll never start. Perfect timing doesn't come. Conditions never align perfectly. But if you start today, a year from now you'll be ahead. If you wait for perfect conditions, a year from now you'll be exactly where you are now. The time to start is always today. Imperfect start beats perfect planning. Begin now. Time will pass either way. Make it count."
142,"Can small steps really lead to big accomplishments?","Each accomplishment and big milestone in life starts with just one small step. Mountains are climbed one step at a time. Empires are built one brick at a time. Books are written one page at a time. No accomplishment happens all at once. They all happen through accumulated small steps. Don't be discouraged by size of your goal. You don't need to see the whole path. You need the next step. Take it. Then the next."
143,"Should I dream big or start small?","Dream big, start small. Vision without execution is daydreaming. Execution without vision is busywork. You need both. Dream magnificently. See your ideal future clearly. Then start small. Take manageable first steps. Build momentum. Expand gradually. The combination is powerful. Big dreams without small starts never happen. Small starts without big dreams create small results. Vision provides direction. Small starts provide momentum. Combined they create achievement. Dream huge. Start small. Build steadily."
144,"Do I need to wait for someone to help me figure things out?","Quick reminder: I'm only a phone call away if you want to talk. Others are available. You don't have to figure everything out alone. Connection helps. Perspective helps. Support helps. Reach out. Vulnerability connects. Asking for help isn't weakness; it's intelligence. Others have faced similar challenges. Their experience could guide yours. Don't suffer alone. Let others in. Community is supposed to carry us during hard times. Make that call."
145,"When I'm panicking, what's my first step?","Breathe in. Breathe out. Then take it one step at a time. Panic paralyzes. Breathing calms. Once calm, action becomes possible. You don't have to solve everything at once. You only have to take the next step. One step, then another, then another. Panic imagines all future problems simultaneously. Action handles one challenge at a time. Breathing resets your nervous system. Then move. One step. That's all you need to do right now. One step."
146,"Why do I feel like I'm not enough?","You're enough. You have inherent worth that doesn't depend on achievement, appearance, or approval. This is fundamental. You don't have to earn enough. You're already enough. Growth is about becoming better, not because you're not enough but because growth is your nature. Pursue excellence not from lack but from abundance. This shifts everything. When you know you're enough, you act from confidence not desperation. You're enough right now. Remember this always."
147,"How do I handle feeling stuck in my progress?","Progress isn't always visible. Like compound interest, growth accumulates silently. You might feel stuck when you're actually advancing. Check your trajectory quarterly. Compare yourself to a year ago, not yesterday. The compound effect takes time to show. Don't expect instant results. Patience plus consistency produces breakthrough. Most people quit during invisible progress. Don't be most people. Trust the process. Keep going. Your breakthrough is likely closer than you think. Stay consistent."
148,"Should I prepare extensively or just start and learn?","There's wisdom in both preparation and action. Over-preparation becomes procrastination. No preparation becomes chaos. Find balance. Prepare enough to begin. Then learn through doing. Real lessons come from real experience. Theory guides; practice teaches. Start before you feel ready. You'll discover what you need to know through challenges that arise. Perfectionists over-prepare forever. Pragmatists prepare reasonably then learn by doing. Be pragmatic. Prepare less, act more."
149,"Why does comparison steal my joy?","Comparison is invisible poison. When you compare yourself to others, you're comparing your behind-the-scenes to their highlight reel. You lose. Always. They show victories; you see all your struggles. You see their finished product; you live through their messy process. Comparison is unfair. Stop it. Focus on your progress. You're exactly where you need to be on your path. Their path isn't your path. Run your race. Let them run theirs. Joy returns when comparison stops."
150,"Can I recover from major mistakes?","Everyone makes major mistakes. They're not permanent. You're not defined by them. They're evidence you tried something. They're data for improvement. Extract lessons. Make amends if needed. Then move forward differently. Regret wastes energy. Learning from mistakes frees energy. You're not your mistakes. You're how you respond to them. People respect those who fall and rise more than those who never try. Your comeback is more powerful than your fall. Rise differently."
151,"What if I fail at my biggest dream?","Failure is evidence you tried. You attempted something that mattered. You took the risk. Most people never do. If you fail, you'll have incredible stories and valuable lessons. If you never try, you'll have regret. Between failure and regret, failure is better. You gain something from failure. You gain nothing from unrealized dreams. Attempt your dream. Some attempts succeed. Some don't. But the act of attempting transforms you. Attempt it."
152,"Should I compete or cooperate?","Competition brings out excellence. Cooperation brings out creativity. Use both strategically. Compete where competition drives improvement. Cooperate where cooperation amplifies impact. Win-lose thinking limits you. Win-win thinking expands you. You can succeed without others failing. Often their success enables yours. Build alliances. Share knowledge. Lift others. Networks matter more than individual achievement. Cooperation compounds. Competition is valuable but limited. Both together create sustainable success. Cooperate generously. Compete fairly. Build together."
153,"How do I stay connected to my why?","Your why is your fuel. When why is clear and strong, how becomes possible. When why erodes, motivation vanishes. Revisit your why regularly. Why do you pursue this goal? Why does it matter? Why are you the person to pursue it? Write it down. Say it aloud. Connect daily. When struggle arrives—and it will—your why sustains you. Focus on why, not how. Why is powerful. How is just logistics. Strong why carries you through how's difficulty."
154,"Does the order of my actions matter?","Some sequences matter more than others. Build foundation first. Master fundamentals. Expand later. You don't build a house starting with the roof. You don't learn calculus before algebra. Sequence matters. But analysis of perfect sequence often prevents action. Good sequence with action beats perfect sequence with no action. Plan roughly. Execute immediately. Adjust as you learn. Sequencing is guide, not law. Start with something sensible. Action reveals what you should do next. Move forward."
155,"Why do I sabotage myself when success nears?","Success brings visibility. Visibility brings responsibility. Part of you might fear that. Success changes identity. You become "the successful person." That shift is real and can be frightening. Sabotage prevents this change. But the change is growth. Embrace it. You deserve success. Success isn't dangerous; it's opportunity. Fear is liar. When success approaches and you feel urge to sabotage that's fear speaking. Recognize it. Dismiss it. Claim your success. You're ready. You deserve it."
156,"How do I build genuine confidence?","Genuine confidence comes from evidence. Do hard things. Overcome challenges. Keep score. You've likely overcome more than you remember. Review past wins. Remember past resilience. Accumulate evidence of capability. Fake confidence is ego. Genuine confidence is knowing. You know you can because you've proven it. Others can sense the difference. Real confidence is attractive. Build it through action. Each challenge overcome increases confidence. You're building capability constantly. Own it. You're becoming whoever you're becoming."
157,"Should I wait until I'm more qualified?","You'll never feel completely ready. Qualifications can always increase. But timing matters too. At some point, more preparation becomes avoidance. You're ready when you understand fundamentals and can learn through doing. Start while imperfect. Perfectionism prevents progress. Good enough gets started. Excellence develops through practice. Waiting costs years. Starting now costs temporary discomfort. Then comes growth. Choose growth. You're already qualified enough. Begin. You'll become more qualified through action."
158,"What if people judge my unconventional choices?","Judgment is inevitable. Pioneers were judged. Innovators were judged. Everyone doing anything different is judged. But judgment reveals others' limitations, not your failures. People judge what they don't understand. Let them. Your job is being true to yourself, not managing others' opinions. History vindicates unconventional people. Future success doesn't matter what present people think. Make choices aligned with your values. Let others judge. Your life is yours. Live it your way. Judge yourself kindly."
159,"How do I balance ambition with presence?","Ambition without presence creates anxiety. You're always reaching, never satisfied. Presence without ambition creates stagnation. You're comfortable but not growing. Together they create peace amid growth. Appreciate where you are. Push toward where you're going. Feel current gratitude. Maintain future vision. This balance is available now. You don't have to choose between contentment and growth. Have both. Be here now. Want more later. Enjoy journey while building destination. Both are possible."
160,"Why do some people seem to get all the breaks?","Luck is preparation meeting opportunity. Some people appear lucky because they're prepared when opportunities arise. Others miss opportunities because they're unprepared. Develop yourself so when opportunities come, you can use them. Increase probability through readiness. Read. Learn. Build skills. Network. Grow. Opportunities exist everywhere for prepared people. Most people aren't prepared so they don't see them. Become prepared. Then luck finds you. But really, it's just preparation finally meeting opportunity."
161,"What if failure means I'm foolish?","Failure means you tried something risky. Foolishness is not trying. The brave attempt. Some succeed. Some fail. All grow. Foolishness is knowing what you want and not pursuing it. Real foolishness is safety. Attempting is brave. Results are secondary to the attempt. You prove something through trying: that you're capable of risk. That matters more than whether you succeeded. Don't let fear of appearing foolish stop your attempting. Attempting is always wise."
