s.no,person1,person2
61,"What if I feel like an imposter?","Most high achievers experience imposter syndrome. The gap between your internal doubt and external success creates cognitive dissonance. Remember: you earned what you have. You're capable. Others feel similarly. Imposter syndrome decreases with experience and acknowledgment. Collect evidence of your capabilities. Talk to others about it. Realize that feeling like an imposter doesn't make you one. Keep going despite doubt."
62,"How do I handle criticism constructively?","Some criticism is valuable; some is just noise. Listen past emotion to find the kernel of truth. Even harsh criticism might contain wisdom. Separate the criticism from your identity. Someone criticizing your work isn't criticizing your worth. Extract useful information. Discard the rest. Some critics are invested in your growth; some want to pull you down. Know the difference. Let critics who care guide you."
63,"Why do people fear vulnerability?","Vulnerability feels like weakness, but it's actually strength. It requires courage to show real self. Vulnerability opens connection, but it risks rejection. Yet people sense authenticity and respond to it. Guarded, perfect versions of yourself repel genuine connection. Gradually increase vulnerability with trusted people. Share struggles, not perfection. You'll find that others relate to your struggles more than your successes."
64,"How do I build self-discipline?","Discipline isn't restriction; it's freedom. Freedom to pursue what matters. Discipline comes from clear priorities. When you know why, discipline follows naturally. Start with small commitments—small enough to keep daily. This builds confidence. Gradually increase. Remove temptations. Make good choices easy. Track progress. Environment shapes discipline more than willpower. Design an environment supporting your goals. Join people with high standards."
65,"What creates lasting happiness?","Happiness from external sources—possessions, achievements, praise—is temporary. True happiness comes from within: purpose, relationships, growth, health, and autonomy. You can't buy it. It's built through living aligned with values. It emerges from meaningful connections. It comes from growth and learning. It increases with contribution. Happiness is a byproduct of a well-lived life. Stop chasing it directly. Build the conditions for it."
66,"How do I stop comparing my beginning to others' middle?","Social media shows highlight reels. You're seeing others' success stage after years of invisible work. Their beginning looked like yours—messy, uncertain, small. Stop measuring. Focus on your trajectory, not absolute position. Are you better than last year? Moving toward goals? Learning? That's what matters. Comparison is theft of joy. Delete apps if needed. Protect your peace by limiting comparison exposure."
67,"Why do people not pursue their dreams?","Fear is the primary reason. Fear of failure, judgment, hardship. But also lack of clarity. Some people don't know what they want. Others want competing things. Some believe it's impossible. Some believe they don't deserve it. Start by clarifying your dream. Make it specific. Break it into steps. Start the first step today. Often fear decreases when you start. Action dissolves fear."
68,"How do I build credibility in my field?","Credibility comes from consistent contribution over time. Show up repeatedly. Do good work. Help others. Share knowledge. Build reputation through small wins accumulating into big credibility. Be reliable. Deliver on promises. Stay current with your field. Contribute uniquely. Find your angle. What can only you offer? Credibility takes years to build and seconds to lose. Protect it carefully through integrity and consistency."
69,"What should I do when progress seems invisible?","Progress isn't always visible daily. Like compound interest, it accumulates silently. A year later, the changes are obvious. Monthly, they're subtle. Daily, they're invisible. Track progress numerically where possible. Check in quarterly. Compare yourself to a year ago, not yesterday. Invisible progress is still progress. Trust the system. Keep showing up. The breakthrough often comes just after giving up. Don't quit before harvest."
70,"How do I let go of control?","Control is an illusion. You control very little—only your thoughts, effort, and response. Most of life is beyond control. Acceptance brings peace. You can influence outcomes through good choices, but can't guarantee them. Let go of how things should be. Adapt to how things are. This flexibility is powerful. Control creates anxiety. Acceptance creates peace. Plan carefully, then release attachment to outcomes."
71,"Why do I procrastinate on important tasks?","Procrastination is pain avoidance. The task feels hard, boring, or scary. So you delay. But delay increases stress and decreases time. The solution is starting before you feel ready. The first step is always hardest. After you start, momentum carries you. Use the two-minute rule: commit to two minutes. Usually you'll continue. Or break the big task into smaller, less intimidating steps."
72,"How do I maintain motivation long-term?","Short-term motivation fades. Long-term motivation requires connecting to deeper purpose. Remember your why. Visualize your goal regularly. Celebrate progress. Connect with community pursuing similar goals. Mix process goals with outcome goals. Process goals—daily actions—provide consistent motivation. Outcome goals provide direction. Track both. Mix variety. Doing the same thing endlessly kills motivation. Refresh approaches. Reconnect to purpose quarterly."
73,"What if I don't know what I want to do?","Not knowing is okay. You don't need total clarity to start. Explore broadly. Try different things. Take on projects. Volunteer. Notice what energizes you. What makes you lose track of time? What problems frustrate you? Your interests will gradually clarify. Clarity comes from doing, not thinking. Start somewhere. Adjust based on what you learn. Your path reveals itself through walking it."
74,"How do I handle setbacks emotionally?","Setbacks trigger emotion. Feel it. Cry if needed. Grieve. Don't suppress. But don't live there. Limit time in emotion. Then shift to thinking: What went wrong? What did I learn? How do I adjust? Emotion provides energy. Use it. Transform it into determination. Tell the story differently: this isn't failure; it's redirection. Your response to setbacks defines you. Make it a powerful one."
75,"Why do some people inspire others?","Inspiring people have clarity on their vision. They're making progress toward it. They're growing visibly. They're vulnerable about struggles. They're generous with support. They believe in possibility. People follow clarity and conviction more than charisma. Become inspiring by living inspired. Pursue something bigger than yourself. Keep growing. Share struggles alongside successes. Model what's possible."
76,"How do I build an extraordinary life?","Extraordinary starts with small, consistent daily choices. Nothing dramatic. Just different choices repeatedly. Read instead of scrolling. Exercise instead of sitting. Create instead of consuming. Connect instead of isolating. These tiny choices compound into a completely different life over years. You don't build extraordinary lives in big moments. You build them in small moments accumulated. Which daily choice will you change today?"
77,"What's the price of staying in your comfort zone?","Comfort feels safe but extracts hidden cost. Stagnation. Anxiety. Regret. Limited capability. Missed opportunities. Unrealized potential. Growth requires discomfort. Every skill, relationship, achievement exists just beyond comfort. Small steps outside comfort build confidence. You realize you're capable of more than you thought. Comfort zone shrinks as you age. Expanding it while young is crucial. The cost of staying comfortable is remaining small."
78,"How do I know if something is worth pursuing?","Ask: Does this align with my values? Does this use my strengths? Do I feel energized or drained? Is there a real need for this? Can I make a difference? When multiple yeses emerge, it's worth pursuing. Also consider opportunity cost: What would you not do if you did this? Make sure you're gaining more than losing. Pursue things that compound—building skills, relationships, wealth. Avoid one-time events that consume resources."
79,"Why do people settle for mediocrity?","Fear is usually why. Fear of judgment, failure, ambition. Settling feels safer. But it creates slow regret. People regret most what they didn't try. Mediocrity kills your soul quietly. You know you're capable of more. Mediocrity silently whispers you've settled. Don't settle. Even if you fail, you'll have fewer regrets than if you never tried. Shoot for extraordinary. Miss and you still land higher than settling."
80,"How do I help others while protecting my own wellbeing?","Helping from fullness is sustainable. Helping from emptiness is unsustainable and burns you out. First fill your cup. Your health, rest, boundaries, and resources must be secure. Then help from overflow. Say no when you can't genuinely help. It's okay. Your wellbeing isn't selfish; it's necessary. You can't pour from an empty cup. Protect your peace. Help from that protected space."
81,"What makes a person magnetic?","Magnetic people have presence—they're fully here, not distracted. They're interested in others. They listen. They make others feel valued. They have passion and conviction about something. They're comfortable with themselves. They contribute. They're not seeking approval; they already approve of themselves. Magnetism comes from internal confidence radiating outward. Build it by liking yourself, pursuing growth, and genuinely valuing others."
82,"How do I overcome fear of public speaking?","Most people fear it. You're not alone. Fear decreases with preparation and practice. Prepare thoroughly—know your material. Practice repeatedly. Deliver in front of mirrors, friends, then larger groups. Fear is highest before. During, you're focused. After, you're relieved. Each talk is easier than the last. Find your speaking style. Speak like you talk, not formally. Connect with the audience as individuals. Fear decreases through action."
83,"Why do people underestimate their potential?","Limiting beliefs come from past feedback, family messages, society's expectations. You internalized these without questioning. But beliefs aren't facts. You can change them. Seek evidence contradicting limitations. Notice when you're selling yourself short. Try things you think you can't do. Surprise yourself. Every success rewrites your belief about capability. You're probably capable of far more than you believe. Test this assumption."
84,"How do I stay focused on what matters?","Say no to distraction. Multiple priorities diffuse energy. One clear priority focuses energy. Everything else is secondary. What's your one big thing? Direct energy there. Secondary items get leftovers. Ruthlessly protect focus. Turn off notifications. Batch check emails. Create uninterrupted time. Your attention is your most valuable resource. Guard it carefully. Shallow focus creates shallow results. Deep focus creates deep results."
85,"What's the relationship between rest and productivity?","Rest isn't wasted time; it's necessary maintenance. Your brain consolidates learning during sleep. Your body recovers during rest. Your creativity recharges during breaks. Productivity crashes without adequate rest. It's like running on a battery—you must recharge. Sleep is crucial. Breaks throughout the day are crucial. Weekends are crucial. Vacation is crucial. High performers prioritize rest. They know productivity requires it."
86,"How do I build confidence in areas I'm weak?","Confidence comes from repeated success. Start small in weak areas. Do something slightly hard. Succeed. Repeat. Each small success builds confidence. You don't jump to hard. You climb gradually. Also, reframe weakness: it's not permanent. It's current state. With practice, anyone can improve. See weakness as potential, not limitation. Growth mindset transforms how you approach weakness. Weakness is an opportunity to develop."
87,"Why do people fear asking for help?","Pride, shame, independence. We're taught to be self-sufficient. But asking for help isn't weakness; it's intelligence. You recognize you don't know everything. You're open to learning. Asking for help builds relationships. The person helping feels valued. Most people like being asked. Your refusal to ask creates isolation and prevents progress. Asking for help accelerates everything. Ask. People usually say yes."
88,"How do I make my ideas reality?","Ideas are common. Execution is rare. Most people stop after the idea. The gap between idea and reality is work. Break your idea into steps. Start today. Work daily. Share your progress. Get feedback. Adjust. Keep going despite obstacles. Millions have great ideas. Hundreds take action. Tens keep going. One gets results. Which one will you be?"
89,"What creates deep satisfaction?","Deep satisfaction isn't from ease; it's from challenge and growth. It's from creating. It's from contributing. It's from meaningful relationships. It's from pursuing purpose. It's from continuous growth. It's not from consumption or comfort. Yet most people chase comfort and consumption. Satisfaction hides where growth happens. It hides in challenge. It hides in contribution. Pursue satisfaction by pursuing worthy challenges."
90,"How do I handle people who don't believe in me?","Belief is internal work. Others' doubt says nothing about you. It says something about their vision or experiences. Surround yourself with believers, but don't depend on them. Your belief matters most. Build that first. Prove to yourself you can. Then their doubt won't shake you. Some people will always doubt. That's their limitation. Your job is believing in yourself regardless."
91,"Why do I feel like something's missing?","Emptiness often signals misalignment. You're not following your purpose. You're not growing. You're not contributing. You're not deeply connected. You're sleepwalking. Wake up. What brings energy? What matters? What would you regret not doing? The missing piece is usually clarity and action. It's pursuing something meaningful. It's connecting deeply. It's growing. Fill the emptiness by living intentionally."
92,"How do I build wealth slowly but surely?","Wealth is built through compound growth. Small, consistent investments over time become large. Living below your means frees money to invest. Learning to manage money well is crucial. Diversify income. Increase value. Save regularly. Invest wisely. Wealth building requires patience, discipline, and time. It's boring compared to lottery fantasy. But it works. Time is your greatest asset. The earlier you start, the more time compounds for you."
93,"What if everyone doubts my ability except me?","Then you have everything you need. Self-belief is the foundation. Others' doubt doesn't matter. History is filled with people dismissed by everyone then proven brilliant. Trust yourself. You know your capability better than anyone. Others see surfaces. You know your depths. Prove yourself through work, not argument. Let results speak. Eventually, doubters become believers. Your job is delivering, not convincing."
94,"How do I know I'm on the right path?","Right path feels aligned. It energizes more than drains. It uses your strengths. It serves something bigger. It's challenging but not torture. It offers growth. Progress is visible. You feel alive. Wrong path feels misaligned. It drains more than energizes. You're forcing against your nature. No progress despite effort. You feel dead inside. Your body knows. Listen to it. Gut feelings usually guide correctly."
95,"Why do some people achieve goals others don't?","The primary difference is action. Goal-achievers work. Non-achievers think about working. The secondary difference is persistence. Achievers continue through obstacles. Non-achievers quit at obstacles. The tertiary difference is course correction. Achievers adjust approaches. Non-achievers repeat failed methods. Consistency, persistence, and flexibility—these three create achievement. It's not genius. It's not luck. It's these three applied for long enough."
96,"How do I cultivate gratitude during hardship?","Gratitude doesn't deny hardship. It's noticing good alongside hard. You're struggling and breathing. You're suffering and connected to people. You're failing and learning. Difficulty contains gifts if you look. Gratitude reframes perspective. It doesn't change circumstances but changes how they affect you. During hardship, identify three good things daily. This rewires brain toward noticing. Gratitude makes difficulty bearable."
97,"What's the secret to making real change?","Real change requires clarity, commitment, and action. Be crystal clear on what's changing and why. Write it down. Tell others. Create barriers to old behavior. Create ease for new behavior. Start immediately. Changes stick through repetition. Expect setbacks; they're normal. Keep going. Change takes ninety days minimum for new neural pathways. Most people quit at thirty. Persist. Change is possible; the price is consistency."
98,"How do I leave a meaningful legacy?","Legacy isn't what you accumulate; it's who you help. It's ideas you share. It's people you develop. It's problems you solve. It's love you give. It's values you model. Start now. Legacy building isn't end-of-life work; it's throughout-life work. How do you want people to remember you? Build that now. Every action counts toward legacy. Make choices daily that build the legacy you want."
99,"Why do most people not achieve their potential?","Most people never try. Fear stops them before they start. Of those who try, most quit when difficulty arrives. Of those who persist, most lack strategy. Of those with strategy, most lack consistency. Very few combine courage, persistence, strategy, and consistency long enough to achieve potential. Your potential isn't mysterious. It's the result of these four sustained. You have everything needed. The question is: will you do it?"
100,"How do I live without regrets?","Live aligned with values. That's the foundation. Make deliberate choices toward what matters. Don't sleepwalk. When opportunities appear, take them despite fear. Try things. Fail some. Succeed some. Stay connected to loved ones. Contribute. Grow. At life's end, you'll have failed, succeeded, lost, won. But you won't regret trying. Regret comes from not trying. Live bold. Take chances. Show up fully. This creates a life well-lived."
101,"Why do people forget what I say but remember how I made them feel?","Because emotions create deeper memories than words. John Lennon taught that people forget your words and actions, but never forget how you made them feel. Your emotional impact is your lasting legacy. Focus on making others feel valued, heard, and inspired. When you approach interactions with genuine care and warmth, those feelings stick with people forever. That emotional resonance is far more powerful than anything you could say."
102,"How can I keep enthusiasm when failing repeatedly at my goals?","Winston Churchill said success consists of going from failure to failure without loss of enthusiasm. This means you will fail—repeatedly. The secret isn't avoiding failure; it's maintaining your belief despite it. Each failure teaches you something crucial. Your enthusiasm signals to yourself and others that you're still in the game. When others see you bounce back with energy, they believe in you more. Keep that fire alive."
103,"What makes the difference between achievers and people who dream only?","Michael Jordan said he can accept failure because everyone fails, but he can't accept not trying. The difference is taking action despite fear. Dreamers stay comfortable. Achievers step into discomfort. Trying means risking failure. Most people won't risk it. Achievers will. They understand that the real failure is never attempting. This willingness to try, fail, try again separates those who achieve from those who merely wish."
104,"Does my natural talent matter more than my attitude toward challenges?","Your attitude matters significantly more than innate talent. Zig Ziglar said your attitude, not your aptitude, will determine your altitude. Two people with identical talent can have vastly different outcomes based on their mindset. Someone with average talent but positive, growth-oriented thinking will outperform someone gifted but defeatist. Your attitude shapes effort, persistence, resilience, and learning. Cultivate belief in yourself and commitment to growth. Attitude transforms what talent alone cannot."
105,"Can I really change my life by changing how I think?","William James discovered that humans can alter their lives by altering their attitudes. This is profound. Your thoughts precede your actions. Your actions create results. Your results become your reality. Negative thinking creates negative actions and outcomes. Positive, intentional thinking creates empowering actions and better results. You're not trapped by circumstance. You're empowered by mindset. Begin today by deliberately choosing different thoughts. Watch your life transform accordingly."
106,"How do small improvements in my life create bigger external changes?","Paulo Coelho said when we strive to become better, everything around us becomes better too. This isn't coincidence. As you improve yourself—your skills, character, health, knowledge—you naturally attract better opportunities and people. You treat others differently. You make better decisions. You see possibilities you previously missed. Others notice your growth and respond positively. Your internal development creates an external ripple effect. Invest in becoming better, and everything else elevates."
107,"What if I can't do great things—what should I guide myself toward?","Napoleon Hill taught that if you can't do great things, do small things in a great way. This removes the excuse of waiting for perfect conditions. You don't need grandiose plans to succeed. You need excellence in whatever you do now. Mastery in small things compounds. Someone excellent at small tasks becomes capable of larger ones. Quality at any scale builds reputation and capability. Start where you are with what you have and do it excellently."
108,"When I get knocked down by failure, how do I know I should get back up?","Vince Lombardi said it's not whether you get knocked down; it's whether you get up. Getting knocked down is inevitable—everyone experiences failure. What separates people is their response. Getting back up requires courage and belief. Each time you rise after falling, you prove to yourself you're stronger than the setback. You build resilience. This resilience compounds. Eventually, nothing can keep you down because you've proven you always rise."
109,"Is courage something you're born with or can you develop it?","Ruth Gordo revealed that courage is like a muscle—you strengthen it through use. You aren't born brave or cowardly. Courage develops through action. Each time you do something despite fear, you strengthen your courage muscle. Start small. Do one brave thing today. Tomorrow, do another. Over time, things that terrified you become manageable. Bravery becomes your default. Courage isn't the absence of fear; it's action despite fear. Build it daily."
110,"Who holds the power to tell me I can't succeed?","Jessica Ennis said the only one who can tell you 'you can't win' is you, and you don't have to listen. External voices will doubt. Critics will emerge. Obstacles will appear. But internal doubt is the real killer. External barriers are less formidable than self-imposed ones. When you believe, you persist through external resistance. When you doubt, you quit before external barriers even test you. Reject your own negative voice. Believe in your capability."
111,"How do I know my goals are worth pursuing despite the obstacles?","Steve Jobs said if you're working on something you really care about, you don't have to be pushed—the vision pulls you. True goals don't require constant external motivation. They pull you forward naturally. If you struggle with motivation, check if you genuinely care about the goal. Misalignment creates struggle. Alignment creates flow. When your work connects to something meaningful, obstacles become bearable. You push through not from discipline but from passion. Care deeply about your pursuits."
112,"Why do some people learn and grow faster than others?"," Vernon Sanders Law noted that experience is a hard teacher because she gives the test first, the lesson afterward. Real learning comes from doing, not theorizing. People who act learn quickly through feedback. People who only think learn slowly through speculation. Mistakes teach faster than success. Each challenge survived provides wisdom. The fastest learners embrace difficulty as teacher. They try, fail, extract lessons, and adjust. Speed of growth depends on speed of action and learning from results."
113,"How do I stop wasting time on things that don't really matter?","Tony Robbins said goal setting is the secret to a compelling future. Without clear goals, you drift. Without direction, you work on whatever appears urgent. Most urgency is someone else's priority. When you set compelling goals, clarity emerges. Suddenly, many activities reveal themselves as distractions. You naturally redirect energy toward what matters. Clear goals act like a filter. Opportunities that don't align with your goals become obviously wrong. Set goals and watch focus follow."
